{
  "invite_code": "sn_invite_aaaaaaaaaaaaaaaaaaaaaaaaaaaaaaaaaaaaaaaaaaa",
  "enrollment_id": "0190f86f-e0de-7f2a-a24c-0a6abf16ec82",
  "device_token": "sn_device_bbbbbbbbbbbbbbbbbbbbbbbbbbbbbbbbbbbbbbbbbbb",
  "device_name": "scanner-console",
  "client_version": "0.1.0",
  "platform": "linux-x86_64"
}
